file,transcription
251-136532-0002.flac,THAT TOOK THE CENTER OF INTEREST AWAY FROM ARCHAEOLOGY AND STARTED A NEW BURST OF ACTIVITY
251-136532-0005.flac,THE DAILY NEWSCASTS FROM TERRA SHOWED A CORRESPONDING SHIFT IN INTEREST AT HOME
251-136532-0010.flac,MARTHA REMEMBERED THE CLOSED DOOR ON THE FIRST SURVEY THEY HADN'T ATTEMPTED OPENING IT
251-136532-0013.flac,MASS SUICIDE THAT'S WHAT IT WAS NOTICE WHAT'S IN THE CORNERS
251-136532-0018.flac,WITHOUT QUESTION HE HAD BECOME OVERNIGHT THE MOST WIDELY KNOWN ARCHAEOLOGIST IN HISTORY
